brand,name,code,unique_code,description,notes
Penhaligon's,Sartorial,PS,PS,"A fragrance for a new generation of gentlemen, inspired by the scents of the workroom at Norton & Sons, bespoke tailors of Savile Row.","['aldehydes', 'ozonic effect', 'metallic effect', 'violet leaf', 'neroli', 'cardamom', 'black pepper', 'fresh ginger', 'beeswax', 'cyclamen', 'linden blossom', 'lavender', 'leather', 'gurgum wood', 'patchouli', 'myrrh', 'cedarwood', 'tonka bean', 'oakmoss', 'white musk', 'honey effect', 'old wood effect', 'vanilla', 'amber']"
Penhaligon's,Juniper Sling,PJ,PJ,"Nothing brings jubilance and joy to the senses quite like Gin! And now a cocktail, or Sling, a tribute to les annes folle, the exuberant 1920s that roared that is one part crisp, evening-elegance, one part party-playful effervescence.","['cinnamon', 'orange brandy', 'angelica', 'juniper berry', 'cardamom', 'leather', 'black pepper', 'orris wood', 'brown sugar', 'black cherry', 'vetiver', 'ambrox']"
Penhaligon's,Halfeti,PH,PH,"Halfeti draws inspiration from the lavish goods traded with Turkey by the Levant Company; exotic florals, spices, soft leathers and precious fabrics.
 The fragrance is named for the stunning black roses that grow on the banks of the Euphrates river in the small Turkish village of Halfeti. Dark and mysterious, the roses are exceedingly rare as a result of the unique environmental conditions in which they are grown.","['grapefruit', 'bergamot', 'green notes', 'armoise', 'lavender', 'cardamom', 'cumin', 'nutmeg', 'saffron', 'violet', 'cinnamon', 'rose', 'jasmine', 'cypress', 'muguet', 'leather', 'oud', 'amber', 'resins', 'cedarwood', 'patchouli heart', 'tonka', 'vanilla', 'sandalwood', 'musk']"
Penhaligon's,Highgrove Bouquet,PH,PI,"Created by perfumer Julie Pluchet working with the Prince of Wales. Inspired by the scent of the Highgrove estate's weeping silver lime trees (Tilia 'Petiolaris'), the odour of which was recreated using headspace technology.10% of sales will be donated to The Prince's Foundation.","['weeping silver lime', 'mimosa', 'tuberose', 'hyacinth', 'lavender', 'geranium', 'orris', 'cedarwood', 'musks']"
Thierry Mugler,Angel,TA,TA,"No flowers in this scent! Just a whole load of food: Chocolate, Vanilla, Caramel... Its uniqueness is what makes it so popular, but also the reason others can't stand it.","['bergamot', 'strawberry', 'dewberry', 'helonial', 'honey', 'jasmine', 'orchid', 'rose', 'chocolate', 'caramel', 'coumarin', 'patchouli', 'sandalwood', 'vanilla', 'musk']"
Thierry Mugler,A*Men / Angel Men,TA,TZ,"This very distinct sweet fragrance is one of those you either love or hate. Based strongly on the ladies Angel; A*Men (Angel Men in the US) contains unusual notes of Chocolate, Coffee and Caramel. Most of the notes are ""edible"", so this would appeal to anyone with a sweet tooth. Funky bottle too, which is also available encased in black rubber, that is not only looks stylish but is ideal for travelling.","['bergamot', 'helonial', 'lavender', 'peppermint', 'coffee bean', 'tar', 'patchouli', 'tonka bean', 'vanilla', 'caramel', 'chocolate', 'musk']"
Thierry Mugler,Mugler Cologne,TM,TM,"Inspired by the clean fresh scent of a soap from Mugler's childhood, Cologne was designed to appeal to people who don't really like fragrance! Cologne draws on the tradition of early colognes, it is fresh and citrus-sy and is the olfactory opposite of the distinctive scent of Angel. The scent contains a mystery ingredient, only known as 'S'... maybe it's Sausage?, Salmon?, Soap?, Selotape?.. or maybe its 'S-Perfume' all over again! The bath line includes a scent free natural crystalline alum stone deodorant, which lasts an age, and you can add your own fragrance too.","['bergamot', 'neroli', 'petitgrain', 'orange flower', 'white musk']"